Prep	Cast	Spell	Sch	Sub	Descriptor	Comp	Cast	Range	Target/Effect	Duration	Save	SR	Description	Book	pg	B	C	D	P	R	W	O
		Acid Fog	con	creation	acid	V,S,M/DF	1std	med	fog spreads in 20-ft radius, 20 ft high	1 rd/lvl	-	n	Fog deals acid damage.	PHB	196						6	
		Acid Splash	con	creation	acid	V,S	1std	close	one missile of acid	instant	-	n	Orb deals 1d3 acid damage.	PHB	196						0	
		Aid	ench	compulsion	mind-affecting	V,S,DF	1std	touch	living creature touched	1 min/lvl	-	y (h/l)	+1 on attack rolls and saves against fear, 1d8 temporary hp +1/level (max +10).	PHB	196		2					
		Air Walk	tran		air	V,S,DF	1std	touch	creature (gargantuan or smaller) touched	10 min/lvl	-	y (h/l)	Subject treads on air as if solid (climb at 45-degree angle).	PHB	196		4	4				
		Alarm	abj			V,S,F/DF	1std	close	20-ft-radius emanation centered on a point in space	2 hrs/lvl (d)	-	n	Wards an area for 2 hours/level.	PHB	197	1				1	1	
		Align Weapon	tran		varies	V,S,DF	1std	touch	weapon touched or fifty projectiles (all of which must be in contact with each other at the time of casting)	1 min/lvl	will neg (h/l, obj)	y (h/l, obj)	Weapon becomes good, evil, lawful, or chaotic.	PHB	197		2					
		Alter Self	tran			V,S	1std	personal	you	10 min/lvl (d)			Assume form of a similar creature.	PHB	197	2					2	
		Analyze Dweomer	div			V,S,F	1std	close	one obj or creature per caster level	1 rd/lvl (d)	- or will neg; see text	n	Reveals magical aspects of subject.	PHB	197	6					6	
		Animal Growth	tran			V,S	1std	med	up to one animal (gargantuan or smaller) per two levels, no two of which can be more than 30 ft apart	1 min/lvl	fort neg	y	One animal/two levels doubles in size.	PHB	198			5		4	5	
		Animal Messenger	ench	compulsion	mind-affecting	V,S,M	1std	close	one tiny animal	1 day/lvl	-; see text	y	Sends a Tiny animal to a specific place.	PHB	198	2		2		1		
		Animal Shapes	tran			V,S,DF	1std	close	up to one willing creature per level, all within 30 ft of each other	1 hr/lvl (d)	-; see text	y (h/l)	One ally/level polymorphs into chosen animal.	PHB	198			8				
		Animal Trance	ench	compulsion	mind-affecting, sonic	V,S	1std	close	animals or magical beasts with intelligence 1 or 2	(c)	will neg; see text	y	Fascinates 2d6 HD of animals.	PHB	198	2		2				
		Animate Dead	nec		evil	V,S,M	1std	touch	one or more corpses touched	instant	-	n	Creates undead skeletons and zombies.	PHB	198		3				4	
		Animate Objects	tran			V,S	1std	med	one small obj per caster level; see text	1 rd/lvl	-	n	Objects attack your foes.	PHB	199	6	6				6	
		Animate Plants	tran			V	1std	close	one large plant per three caster levels or all plants within range; see text	1 rd/lvl or 1 hr/lvl; see text	-	n	One or more trees animate and fight for you.	PHB	199			7				
		Animate Rope	tran			V,S	1std	med	one ropelike obj, length up to 50 ft + 5 ft/level; see text	1 rd/lvl	-	n	Makes a rope move at your command.	PHB	199	1					1	
		Antilife Shell	abj			V,S,DF	1rd	10 ft	10-ft-radius emanation, centered on you	10 min/lvl (d)	-	y	10-ft. field hedges out living creatures.	PHB	199		6	6				
		Antimagic Field	abj			V,S,M/DF	1std	10 ft	10-ft-radius emanation, centered on you	10 min/lvl (d)	-	see text	neg magic within 10 ft.	PHB	200		8				6	
		Antipathy	ench	compulsion	mind-affecting	V,S,M/DF	1hr	close	one location (up to a 10-ft cube/level) or one obj	2 hrs/lvl (d)	will part	y	Object or location affected by spell repels certain creatures.	PHB	200			9			8	
		Antiplant Shell	abj			V,S,DF	1std	10 ft	10-ft-radius emanation, centered on you	10 min/lvl (d)	-	y	Keeps animated plants at bay.	PHB	200			4				
		Arcane Eye	div	scrying		V,S,M	10min	unlimited	magical sensor	1 min/lvl (d)	-	n	Invisible floating eye moves 30 ft./round.	PHB	200						4	
		Arcane Lock	abj			V,S,M	1std	touch	the door, chest, or portal touched, up to 30 sq. ft/level in size	perm	-	n	Magically locks a portal or chest.	PHB	200						2	
		Arcane Mark	uni			V,S	1std	0 ft	one personal rune or mark, all of which must fit within 1 sq. ft	perm	-	n	Inscribes a personal rune (visible or invisible).	PHB	201						0	
		Arcane Sight	div			V,S	1std	personal	you	1 min/lvl (d)			Magical auras become visible to you.	PHB	201						3	
		Arcane Sight, Greater	div			V,S	1std	personal	you	1 min/lvl (d)			As arcane sight, but also reveals magic effects on creatures and objects.	PHB	201						7	
		Armor of Darkness	abj		darkness	V,S,DF	1std	touch	creature touched	10 min/lvl	will neg (h/l)	y (h/l)	Shroud grants deflection bonus, darkvision, and other effects.	PHB								
		Astral Projection	nec		ectomancy	V,S,M	30min	touch	you plus one additional willing creature touched per two caster levels	see text	-	y	Projects you and companions onto Astral Plane.	PHB	201		9				9	
		Atonement	abj			V,S,M,F,DF,XP	1hr	touch	living creature touched	instant	-	y	Removes burden of misdeeds from subject.	PHB	201		5	5				
		Augury	div			V,S,M,F	1min	personal	you	instant			Learns whether an action will be good or bad.	PHB	202		2					
		Awaken	tran			V,S,DF,XP	1day	touch	animal or tree touched	instant	will neg	y	Animal or tree gains human intellect.	PHB	202			5				
		Baleful Polymorph	tran			V,S	1std	close	one creature	perm	fort neg, will part; see text	y	Transforms subject into harmless animal.	PHB	202			5			5	
		Bane	ench	compulsion	fear, mind-affecting	V,S,DF	1std	50 ft	all enemies within 50 ft	1 min/lvl	will neg	y	Enemies take -1 on attack rolls and saves against fear.	PHB	203		1					
		Banishment	abj			V,S,F	1std	close	one or more extraplanar creatures, no two of which can be more than 30 ft apart	instant	will neg	y	Banishes 2 HD/level of extraplanar creatures.	PHB	203		6				7	
		Barkskin	tran			V,S,DF	1std	touch	living creature touched	10 min/lvl	-	y (h/l)	Grants +2 (or higher) enhancement to natural armor.	PHB	203			2		2		
		Bear's Endurance	tran			V,S,DF	1std	touch	creature touched	1 min/lvl	will neg (h/l)	y	Subject gains +4 to Con for 1 min./level.	PHB	203		2	2		2	2	
		Bear's Endurance, Mass	tran			V,S,DF	1std	close	one creature/level, no two of which can be more than 30 ft apart	1 min/lvl	will neg (h/l)	y	As bear's endurance, affects one subject/ level.	PHB	203		6	6			6	
		Bestow Curse	nec			V,S	1std	touch	creature touched	perm	will neg	y	-6 to an ability score; -4 on attack rolls, saves, and checks; or 50% chance of losing each action.	PHB	203		3				4	
		Bigby's Clenched Fist	evo		force	V,S,F/DF	1std	med	10-ft hand	1 rd/lvl (d)	-	y	Large hand provides cover, pushes, or attacks your foes.	PHB	203						8	
		Bigby's Crushing Hand	evo		force	V,S,M,F/DF	1std	med	10-ft hand	1 rd/lvl (d)	-	y	Large hand provides cover, pushes, or crushes your foes.	PHB	203						9	
		Bigby's Forceful Hand	evo		force	V,S,F	1std	med	10-ft hand	1 rd/lvl (d)	-	y	Hand pushes creatures away.	PHB	204						6	
		Bigby's Grasping Hand	evo		force	V,S,F/DF	1std	med	10-ft hand	1 rd/lvl (d)	-	y	Large hand provides cover, pushes, or grapples.	PHB	204						7	
		Bigby's Interposing Hand	evo		force	V,S,F	1std	med	10-ft hand	1 rd/lvl (d)	-	y	Hand provides cover against one opponent.	PHB	204						5	
		Binding	ench	compulsion	mind-affecting	V,S,M	1min	close	one living creature	see text (d)	will neg; see text	y	Utilizes an array of techniques to imprison a creature.	PHB	204						8	
		Black Tentacles	con	creation		V,S,M	1std	med	20-ft-radius spread	1 rd/lvl (d)	-	n	Tentacles grapple all within 15 ft. spread.	PHB	228						4	
		Blacklight	evo		darkness	V,S,M	1std	close	a 20-ft-radius emanation centered on a creature, obj or point in space.	1 rd/lvl (d)	will neg or none (obj)	y or no (obj)	Creates a 20-ft. radius of supernatural darkness you can see through.	PHB							3	
		Blade Barrier	evo		force	V,S	1std	med	wall of whirling blades up to 20 ft long/ level, or a ringed wall of whirling blades with a radius of up to 5 ft per two levels; either form 20 ft high	1 min/lvl (d)	ref ½ or ref neg; see text	y	Wall of blades deals 1d6/level damage.	PHB	205		6					
		Blasphemy	evo		sonic, evil	V	1std	40 ft	nonevil creatures in a 40-ft-radius spread centered on you	instant	- or will neg; see text	y	Kills, paralyzes, weakens, or dazes nonevil subjects.	PHB	205		7					
		Bless	ench	compulsion	mind-affecting	V,S,DF	1std	50 ft	the caster and all allies within a 50-ft burst, centered on the caster	1 min/lvl	-	y (h/l)	Allies gain +1 on attack rolls and saves against fear.	PHB	205		1		1			
		Bless Water	tran		positive, good	V,S,M	1min	touch	flask of water touched	instant	will neg (obj)	y (obj)	Makes holy water.	PHB	205		1		1			
		Bless Weapon	tran			V,S	1std	touch	weapon touched	1 min/lvl	-	n	Weapon strikes true against evil foes.	PHB	205				1			
		Blight	nec			V,S,DF	1std	touch	one plant	instant	fort ½; see text	y	Withers one plant or deals 1d6/level damage to plant creature.	PHB	206			4			5	
		Blindness/Deafness	nec			V	1std	med	one living creature	perm (d)	fort neg	y	Makes subject blind or deaf.	PHB	206	2	3				2	
		Blink	tran			V,S	1std	personal	you	1 rd/lvl (d)			You randomly vanish and reappear for 1 round/level.	PHB	206	3					3	
		Blur	ill	glamer		V	1std	touch	creature touched	1 min/lvl (d)	will neg (h/l)	y (h/l)	Attacks miss subject 20% of the time.	PHB	206	2					2	
		Bolt of Glory	evo		positive, good	V,S,DF	1std	close	ray	instant	-	y	Positive energy ray deals extra damage to evil outsiders and undead.	PHB			6					
		Bolts of Bedevilment	ench		mind-affecting	V,S	1std	med	ray	1 rd/lvl	will neg	y	One ray/round, dazes 1d3 rounds.	PHB		5						
		Brain Spider	div		mind-affecting	V,S,M,DF	1rd	long	up to eight living creatures within range	1 min/lvl	will neg	y	Listen to thoughts of up to eight other creatures.	PHB			7					
		Break Enchantment	abj			V,S	1min	close	up to one creature per level, all within 30 ft of each other	instant	see text	n	Frees subjects from enchantments, alterations, curses, and petrification.	PHB	207	4	5		4		5	
		Bull's Strength	tran			V,S,M/DF	1std	touch	creature touched	1 min/lvl	will neg (h/l)	y (h/l)	Subject gains +4 to Str for 1 min./level.	PHB	207		2	2	2		2	
		Bull's Strength, Mass	tran			V,S,M/DF	1std	close	one creature/level, no two of which can be more than 30 ft apart	1 min/lvl	will neg (h/l)	y (h/l)	As bull's strength, affects one subject/level.	PHB	207		6	6			6	
		Burning Hands	evo		fire	V,S	1std	15 ft	cone-shaped burst	instant	ref ½	y	1d4/level fire damage (max 5d4).	PHB	207						1	
		Call Lightning	evo		electricity	V,S	1rd	med	one or more 30-ft-long vertical lines of lightning	1 min/lvl	ref ½	y	Calls down lightning bolts (3d6 per bolt) from sky.	PHB	207			3				
		Call Lightning Storm	evo		electricity	V,S	1rd	long	one or more 30-ft-long vertical lines of lightning	1 min/lvl	ref ½	y	As call lightning, but 5d6 damage per bolt.	PHB	207			5				
		Calm Animals	ench	compulsion	mind-affecting	V,S	1std	close	animals within 30 ft of each other	1 min/lvl	will neg; see text	y	Calms (2d4 + level) HD of animals.	PHB	207			1		1		
		Calm Emotions	ench	compulsion	mind-affecting	V,S,DF	1std	med	creatures in a 20-ft-radius spread	(c), ≤ 1 rd/lvl (d)	will neg	y	Calms creatures, negating emotion effects.	PHB	207	2	2					
		Cat's Grace	tran			V,S,M	1std	touch	creature touched	1 min/lvl	will neg (h/l)	y	Subject gains +4 to Dex for 1 min./level.	PHB	208	2		2		2	2	
		Cat's Grace, Mass	tran			V,S,M	1std	close	one creature/level, no two of which can be more than 30 ft apart	1 min/lvl	will neg (h/l)	y	As cat's grace, affects one subject/level.	PHB	208	6		6			6	
		Cause Fear	nec		fear, mind-affecting	V,S	1std	close	one living creature with 5 or fewer hd	1d4 rds or 1 rd; see text	will part	y	One creature of 5 HD or less flees for 1d4 rounds.	PHB	208	1	1				1	
		Chain Lightning	evo		electricity	V,S,F	1std	long	one primary target, plus one secondary target/level (each of which must be within 30 ft of the primary target)	instant	ref ½	y	1d6/level damage; 1 secondary bolt/level each deals half damage.	PHB	208						6	
		Changestaff	tran			V,S,F	1rd	touch	your touched staff	1 hr/lvl (d)	-	n	Your staff becomes a treant on command.	PHB	208			7				
		Chaos Hammer	evo		chaotic	V,S	1std	med	20-ft-radius burst	instant (1d6 rds); see text	will part; see text	y	Damages and staggers lawful creatures.	PHB	208							
		Charm Animal	ench	charm	mind-affecting	V,S	1std	close	one animal	1 hr/lvl	will neg	y	Makes one animal your friend.	PHB	208			1		1		
		Charm Monster	ench	charm	mind-affecting	V,S	1std	close	one living creature	1 day/lvl	will neg	y	Makes monster believe it is your ally.	PHB	209	3					4	
		Charm Monster, Mass	ench	charm	mind-affecting	V	1std	close	one or more creatures, no two of which can be more than 30 ft apart	1 day/lvl	will neg	y	As charm monster, but all within 30 ft.	PHB	209	6					8	
		Charm Person	ench	charm	mind-affecting	V,S	1std	close	one humanoid creature	1 hr/lvl	will neg	y	Makes one person your friend.	PHB	209	1					1	
		Chill Metal	tran		cold	V,S,DF	1std	close	metal equipment of one creature per two levels, no two of which can be more than 30 ft apart; or 25 lb. of metal/level, none of which can be more than 30 ft away from any of the rest	7 rds	will neg (obj)	y (obj)	Cold metal damages those who touch it.	PHB	209			2				
		Chill Touch	nec			V,S	1std	touch	creature or creatures touched (up to one/level)	instant	fort part or will neg; see text	y	One touch/level deals 1d6 damage and possibly 1 Str damage.	PHB	209						1	
		Circle of Death	nec		death	V,S,M	1std	med	several living creatures within a 40-ft-radius burst	instant	fort neg	y	Kills 1d4/level HD of creatures.	PHB	209						6	
		Clairaudience/Clairvoyance	div	scrying		V,S,F/DF	10min	long	magical sensor	1 min/lvl (d)	-	n	Hear or see at a distance for 1 min./level.	PHB	209	3					3	
		Cloak of Chaos	abj		chaotic	V,S,F	1std	20 ft	one creature/level in a 20-ft-radius burst centered on you	1 rd/lvl (d)	see text	y (h/l)	+4 to AC, +4 resistance, and SR 25 against lawful spells.	PHB	210		8					
		Clone	nec			V,S,M,F	10min	0 ft	one clone	instant	-	n	Duplicate awakens when original dies.	PHB	210						8	
		Cloudkill	con	creation		V,S	1std	med	cloud spreads in 20-ft radius, 20 ft high	1 min/lvl	fort part; see text	n	Kills 3 HD or less; 46 HD save or die, 6+ HD take Con damage.	PHB	210						5	
		Color Spray	ill	pattern	mind-affecting	V,S,M	1std	15 ft	cone-shaped burst	instant; see text	will neg	y	Knocks unconscious, blinds, and/or stuns 1d6 weak creatures.	PHB	210						1	
		Command	ench	compulsion	mind-affecting, language-dependent	V	1std	close	one living creature	1 rd	will neg	y	One subject obeys selected command for 1 round.	PHB	211		1					
		Command Plants	tran			V	1std	close	up to 2 hd/level of plant creatures, no two of which can be more than 30 ft apart	1 day/lvl	will neg	y	Sway the actions of one or more plant creatures.	PHB	211			4		3		
		Command Undead	nec			V,S,M	1std	close	one undead creature	1 day/lvl	will neg; see text	y	Undead creature obeys your commands.	PHB	211						2	
		Command, Greater	ench	compulsion	mind-affecting, language-dependent	V	1std	close	one creature/level, no two of which can be more than 30 ft apart	1 rd/lvl	will neg	y	As command, but affects one subject/level.	PHB	211		5					
		Commune	div			V,S,M,DF,XP	10min	personal	you	1 rd/lvl			Deity answers one yes-or-no question/level.	PHB	211		5					
		Commune with Nature	div			V,S	10min	personal	the ground or terrain, plants, minerals, bodies of water, people, general animal population, presence of woodland creatures, presence of powerful unnatural creatures, or even the general state of the natural setting.	instant			Learn about terrain for 1 mile/level.	PHB	211			5		4		
		Comprehend Languages	div			V,S,M/DF	1std	personal	you	10 min/lvl			You understand all spoken and written languages.	PHB	212	1	1				1	
		Cone of Cold	evo		cold	V,S,M/DF	1std	60 ft	cone-shaped burst	instant	ref ½	y	1d6/level cold damage.	PHB	212						5	
		Confusion	ench	compulsion	mind-affecting	V,S,M/DF	1std	med	all creatures in a 15-ft radius burst	1 rd/lvl	will neg	y	Subjects behave oddly for 1 round/level.	PHB	212	3					4	
		Confusion, Lesser	ench	compulsion	mind-affecting	V,S,DF	1std	close	one living creature	1 rd	will neg	y	One creature is confused for 1 round.	PHB	212	1						
		Consecrate	evo		positive, good	V,S,M,DF	1std	close	20-ft-radius emanation	2 hrs/lvl	-	n	Fills area with positive energy, making undead weaker.	PHB	212		2					
		Contact Other Plane	div			V	10min	personal	you	(c)			Lets you ask question of extraplanar entity.	PHB	212						5	
		Contagion	nec		evil	V,S	1std	touch	living creature touched	instant	fort neg	y	Infects subject with chosen disease.	PHB	213		3	3			4	
		Contingency	evo			V,S,M,F	10min;seetext	personal	you	1 day/lvl or until dis (d)			Sets trigger condition for another spell.	PHB	213						6	
		Continual Flame	evo		light	V,S,M	1std	touch	magical, heatless flame	perm	-	n	Makes a permanent, heatless torch.	PHB	213		3				2	
		Control Plants	tran			V,S,DF	1std	close	up to 2 hd/level of plant creatures, no two of which can be more than 30 ft apart	1 min/lvl	will neg	n	Control actions of one or more plant creatures.	PHB	213			8				
		Control Undead	nec			V,S,M	1std	close	up to 2 hd/level of undead creatures, no two of which can be more than 30 ft apart	1 min/lvl	will neg	y	Undead don't attack you while under your command.	PHB	214						7	
		Control Water	tran		water	V,S,M/DF	1std	long	water in a volume of 10 ft/level by 10 ft/level by 2 ft/level (s)	10 min/lvl (d)	-; see text	n	Raises or lowers bodies of water.	PHB	214		4	4			6	
		Control Weather	tran			V,S	10min;seetext	2 mi	2-mile-radius circle, centered on you; see text	4d12 hrs; see text	-	n	Changes weather in local area.	PHB	214		7	7			7	
		Control Winds	tran		air	V,S	1std	40 ft/level	40 ft/level radius cylinder 40 ft high	10 min/lvl	fort neg	n	Change wind direction and speed.	PHB	214			5				
		Corrupt Weapon	tran			V,S	1std	touch	weapon touched	1 min/lvl	-	n	Weapon strikes true against good foes.	PHB								
		Create Food and Water	con	creation		V,S	10min	close	food and water to sustain three humans or one horse/level for 24 hours	1 day; see text	-	n	Feeds three humans (or one horse)/level.	PHB	214		3					
		Create Greater Undead	nec		evil	V,S,M	1hr	close	one corpse	instant	-	n	Create shadows, wraiths, spectres, or devourers.	PHB	215		8				8	
		Create Undead	nec		evil	V,S,M	1hr	close	one corpse	instant	-	n	Creates ghouls, ghasts, mummies, or mohrgs.	PHB	215		6				6	
		Create Water	con	creation	water	V,S	1std	close	up to 2 gallons of water/level	instant	-	n	Creates 2 gallons/level of pure water	PHB	215		0	0	1		sorc/wiz	
		Creeping Doom	con	summoning		V,S	1rd	close/ 100 ft; see text	one swarm of centipedes per two levels	1 min/lvl	-	n	Swarms of centipedes attack at your command.	PHB	215			7				
		Crown Of Glory	evo			V,S,M,DF	1rd	120 ft	120-ft-radius emanation, centered on you	1 min/lvl	will neg	y	You gain +4 Charisma and enthrall those who hear you.	PHB								
		Crushing Despair	ench	compulsion	mind-affecting	V,S,M	1std	30 ft	cone-shaped burst	1 min/lvl	will neg	y	Subjects take -2 on attack rolls, damage rolls, saves, and checks.	PHB	215	3					4	
		Cure Critical Wounds	con	healing	positive	V,S	1std	touch	creature touched	instant	will ½ (h/l); see text	y (h/l); see text	Cures 4d8 damage +1/level (max +20).	PHB	215	4	4	5				
		Cure Critical Wounds, Mass	con	healing	positive	V,S	1std	close	one creature/level, no two of which can be more than 30 ft apart	instant	will ½ (h/l) or will ½; see text	y (h/l) or y; see text	Cures 4d8 damage +1/level for many creatures.	PHB	215		8	9				
		Cure Light Wounds	con	healing	positive	V,S	1std	touch	creature touched	instant	will ½ (h/l); see text	y (h/l); see text	Cures 1d8 damage +1/level (max +5).	PHB	215	1	1	1	1	2		
		Cure Light Wounds, Mass	con	healing	positive	V,S	1std	close	one creature/level, no two of which can be more than 30 ft apart	instant	will ½ (h/l) or will ½; see text	y (h/l) or y; see text	Cures 1d8 damage +1/level for many creatures.	PHB	216	5	5	6				
		Cure Minor Wounds	con	healing	positive	V,S	1std	touch	creature touched	instant	will ½(h/l); see text	y (h/l); see text	Cures 1 point of damage	PHB	216		0	0				
		Cure Moderate Wounds	con	healing	positive	V,S	1std	touch	creature touched	instant	will ½ (h/l); see text	y (h/l); see text	Cures 2d8 damage +1/level (max +10).	PHB	216	2	2	3	3	3		
		Cure Moderate Wounds, Mass	con	healing	positive	V,S	1std	close	one creature/level, no two of which can be more than 30 ft apart	instant	will ½ (h/l) or will ½; see text	y (h/l) or y; see text	Cures 2d8 damage +1/level for many creatures.	PHB	216	6	6	7				
		Cure Serious Wounds	con	healing	positive	V,S	1std	touch	creature touched	instant	will ½ (h/l); see text	y (h/l); see text	Cures 3d8 damage +1/level (max +15).	PHB	216	3	3	4	4	4		
		Cure Serious Wounds, Mass	con	healing	positive	V,S	1std	close	one creature/level, no two of which can be more than 30 ft apart	instant	will ½ (h/l) or will ½; see text	y (h/l) or y; see text	Cures 3d8 damage +1/level for many creatures.	PHB	216		7	8				
		Curse Water	nec		evil	V,S,M	1min	touch	flask of water touched	instant	will neg (obj)	y (obj)	Makes unholy water.	PHB	216		1					
		Dancing Lights	evo		light	V,S	1std	med	up to four lights, all within a 10-ft-radius area	1 min (d)	-	n	Creates torches or other lights.	PHB	216	0					0	
		Darkness	evo		darkness	V,M/DF	1std	touch	obj touched	10 min/lvl (d)	-	n	20-ft. radius of supernatural shadow.	PHB	216	2	2				2	
		Darkvision	tran			V,S,M	1std	touch	creature touched	1 hr/lvl	-	y (h/l)	See 60 ft. in total darkness.	PHB	216					3	2	
		Daylight	evo		light	V,S	1std	touch	obj touched	10 min/lvl (d)	-	n	60-ft. radius of bright light.	PHB	216	3	3	3	3		3	
		Daze	ench	compulsion	mind-affecting	V,S,M	1std	close	one humanoid creature of 4 hd or less	1 rd	will neg	y	Humanoid creature of 4 HD or less loses next action.	PHB	217	0					0	
		Daze Monster	ench	compulsion	mind-affecting	V,S,M	1std	med	one living creature of 6 hd or less	1 rd	will neg	y	Living creature of 6 HD or less loses next action.	PHB	217	2					2	
		Death Knell	nec		death, ectomancy, evil	V,S	1std	touch	living creature touched	instant/10 min per hd of subject; see text	will neg	y	Kills dying creature; you gain 1d8 temporary hp, +2 to Str, and +1 level.	PHB	217		2					
		Death Ward	nec		ectomancy	V,S,DF	1std	touch	living creature touched	1 min/lvl	will neg (h/l)	y (h/l)	Grants immunity to death spells and negative energy effects.	PHB	217		4	5	4			
		Deathwatch	nec		evil	V,S	1std	30 ft	cone-shaped emanation	10 min/lvl	-	n	Reveals how near death subjects within 30 ft. are.	PHB	217		1					
		Deep Slumber	ench	compulsion	mind-affecting	V,S,M	1rd	close	one or more living creatures within a 10-ft-radius burst	1 min/lvl	will neg	y	Puts 10 HD of creatures to sleep.	PHB	217	3					3	
		Deeper Darkness	evo		darkness	V,M/DF	1std	touch	obj touched	1 day/lvl (d)	-	n	Object sheds supernatural shadow in 60-ft. radius.	PHB	217		3					
		Delay Poison	con	healing		V,S,DF	1std	touch	creature touched	1 hr/lvl	fort neg (h/l)	y (h/l)	Stops poison from harming subject for 1 hour/ level.	PHB	217	2	2	2	2	1		
		Delayed Blast Fireball	evo		fire	V,S,M	1std	long	20-ft-radius spread	5 rds or less; see text	ref ½	y	1d6/level fire damage; you can postpone blast for 5 rounds.	PHB	217						7	
		Demand	ench	compulsion	mind-affecting	V,S,M/DF	10min	see text	one creature	1 rd; see text	will part	y	As sending, plus you can send suggestion.	PHB	217						8	
		Desecrate	evo		negative, evil	V,S,M,DF	1std	close	20-ft-radius emanation	2 hrs/lvl	-	y	Fills area with negative energy, making undead stronger.	PHB	218		2					
		Destruction	nec		death	V,S,F	1std	close	one creature	instant	fort part	y	Kills subject and destroys remains.	PHB	218		7					
		Detect Animals or Plants	div			V,S	1std	long	cone-shaped emanation	(c), ≤ 10 min/lvl (d)	-	n	Detects kinds of animals or plants.	PHB	218			1		1		
		Detect Chaos	div			V,S,DF	1std	60 ft	cone-shaped emanation	(c), ≤ 10 min/lvl (d)	-	n	Reveals creatures, spells, or objects of selected alignment.	PHB	218		1					
		Detect Evil	div			V,S,DF	1std	60 ft	cone-shaped emanation	(c), ≤ 10 min/lvl (d)	-	n	Reveals creatures, spells, or objects of selected alignment.	PHB	218		1					
		Detect Good	div			V,S,DF	1std	60 ft	cone-shaped emanation	(c), ≤ 10 min/lvl (d)	-	n	Reveals creatures, spells, or objects of selected alignment.	PHB	219		1					
		Detect Law	div			V,S,DF	1std	60 ft	cone-shaped emanation	(c), ≤ 10 min/lvl (d)	-	n	Reveals creatures, spells, or objects of selected alignment.	PHB	219		1					
		Detect Magic	div			V,S	1std	60 ft	cone-shaped emanation	(c), ≤ 1 min/lvl (d)	-	n	Detects spells and magic items within 60 ft	PHB	219	0	0	0			0	
		Detect Poison	div			V,S	1std	close	one creature, one obj, or a 5-ft cube	instant	-	n	Detects poison in one creature or object.	PHB	219		0	0	1	1	0	
		Detect Scrying	div			V,S,M	1std	40 ft	40-ft-radius emanation centered on you	1 day	-	n	Alerts you of magical eavesdropping.	PHB	219	4					4	
		Detect Secret Doors	div			V,S	1std	60 ft	cone-shaped emanation	(c), ≤ 1 min/lvl (d)	-	n	Reveals hidden doors within 60 ft.	PHB	220	1					1	
		Detect Snares and Pits	div			V,S	1std	60 ft	cone-shaped emanation	(c), ≤ 10 min/lvl (d)	-	n	Reveals natural or primitive traps.	PHB	220			1		1		
		Detect Thoughts	div		mind-affecting	V,S,F/DF	1std	60 ft	cone-shaped emanation	(c), ≤ 1 min/lvl (d)	will neg; see text	n	Allows listening to surface thoughts.	PHB	220	2					2	
		Detect Undead	div			V,S,M/DF	1std	60 ft	cone-shaped emanation	(c), ≤ 1 min/lvl (d)	-	n	Reveals undead within 60 ft.	PHB	220		1		1		1	
		Dictum	evo		sonic, lawful	V	1std	40 ft	nonlawful creatures in a 40-ft-radius spread centered on you	instant	- or will neg; see text	y	Kills, paralyzes, slows, or deafens nonlawful subjects.	PHB	220		7					
		Dimension Door	con	teleportation		V	1std	long	you and touched objs or other touched willing creatures	instant	- & will neg (obj)	n and y (obj)	Teleports you short distance.	PHB	221	4					4	
